{
  "schema": "codect.show.v1",
  "input": "stdin",
  "revision": null,
  "mode": "signatures",
  "files": [
    {
      "path": "fixtures/schema/input.rs",
      "language": "rust",
      "projection": {
        "text": "pub struct Session {\n    token: Token,\n}\n\nimpl Session {\n    pub fn refresh(&mut self, token: Token) -> Result<(), Error>;\n}\n\npub trait Store {\n    type Error;\n    fn get(&self) -> Result<(), Self::Error>;\n}\n\npub fn open() -> Session;\n",
        "items": [
          {
            "stable_key": "fixtures/schema/input.rs::type::Session",
            "parent_key": null,
            "kind": "type",
            "name": "Session",
            "span": {
              "start_line": 8,
              "end_line": 10,
              "start_byte": 311,
              "end_byte": 351
            },
            "canonical_text": "pub struct Session {\n    token: Token,\n}"
          },
          {
            "stable_key": "fixtures/schema/input.rs::type::Session::field::token",
            "parent_key": "fixtures/schema/input.rs::type::Session",
            "kind": "field",
            "name": "token",
            "span": {
              "start_line": 9,
              "end_line": 9,
              "start_byte": 336,
              "end_byte": 348
            },
            "canonical_text": "    token: Token,"
          },
          {
            "stable_key": "impl Session",
            "parent_key": null,
            "kind": "trait_implementation",
            "name": "Session",
            "span": {
              "start_line": 12,
              "end_line": 17,
              "start_byte": 353,
              "end_byte": 485
            },
            "canonical_text": "impl Session {\n    pub fn refresh(&mut self, token: Token) -> Result<(), Error>;\n}"
          },
          {
            "stable_key": "impl Session::method::refresh",
            "parent_key": "impl Session",
            "kind": "method",
            "name": "refresh",
            "span": {
              "start_line": 13,
              "end_line": 16,
              "start_byte": 372,
              "end_byte": 483
            },
            "canonical_text": "    pub fn refresh(&mut self, token: Token) -> Result<(), Error>;"
          },
          {
            "stable_key": "fixtures/schema/input.rs::trait::Store",
            "parent_key": null,
            "kind": "trait",
            "name": "Store",
            "span": {
              "start_line": 19,
              "end_line": 22,
              "start_byte": 487,
              "end_byte": 568
            },
            "canonical_text": "pub trait Store {\n    type Error;\n    fn get(&self) -> Result<(), Self::Error>;\n}"
          },
          {
            "stable_key": "fixtures/schema/input.rs::trait::Store::assoc_type::Error",
            "parent_key": "fixtures/schema/input.rs::trait::Store",
            "kind": "associated_type",
            "name": "Error",
            "span": {
              "start_line": 20,
              "end_line": 20,
              "start_byte": 509,
              "end_byte": 520
            },
            "canonical_text": "    type Error;"
          },
          {
            "stable_key": "fixtures/schema/input.rs::trait::Store::method::get",
            "parent_key": "fixtures/schema/input.rs::trait::Store",
            "kind": "method",
            "name": "get",
            "span": {
              "start_line": 21,
              "end_line": 21,
              "start_byte": 525,
              "end_byte": 566
            },
            "canonical_text": "    fn get(&self) -> Result<(), Self::Error>;"
          },
          {
            "stable_key": "fixtures/schema/input.rs::fn::open",
            "parent_key": null,
            "kind": "function",
            "name": "open",
            "span": {
              "start_line": 24,
              "end_line": 28,
              "start_byte": 570,
              "end_byte": 651
            },
            "canonical_text": "pub fn open() -> Session;"
          }
        ]
      },
      "outline": [
        {
          "stable_key": "fixtures/schema/input.rs::type::Session",
          "parent_key": null,
          "kind": "type",
          "name": "Session",
          "span": {
            "start_line": 8,
            "end_line": 10,
            "start_byte": 311,
            "end_byte": 351
          },
          "signature": "pub struct Session {\n    token: Token,\n}",
          "retained_in_mode": true
        },
        {
          "stable_key": "fixtures/schema/input.rs::type::Session::field::token",
          "parent_key": "fixtures/schema/input.rs::type::Session",
          "kind": "field",
          "name": "token",
          "span": {
            "start_line": 9,
            "end_line": 9,
            "start_byte": 336,
            "end_byte": 348
          },
          "signature": "    token: Token,",
          "retained_in_mode": true
        },
        {
          "stable_key": "impl Session",
          "parent_key": null,
          "kind": "trait_implementation",
          "name": "Session",
          "span": {
            "start_line": 12,
            "end_line": 17,
            "start_byte": 353,
            "end_byte": 485
          },
          "signature": "impl Session {\n    pub fn refresh(&mut self, token: Token) -> Result<(), Error>;\n}",
          "retained_in_mode": true
        },
        {
          "stable_key": "impl Session::method::refresh",
          "parent_key": "impl Session",
          "kind": "method",
          "name": "refresh",
          "span": {
            "start_line": 13,
            "end_line": 16,
            "start_byte": 372,
            "end_byte": 483
          },
          "signature": "    pub fn refresh(&mut self, token: Token) -> Result<(), Error>;",
          "retained_in_mode": true
        },
        {
          "stable_key": "fixtures/schema/input.rs::trait::Store",
          "parent_key": null,
          "kind": "trait",
          "name": "Store",
          "span": {
            "start_line": 19,
            "end_line": 22,
            "start_byte": 487,
            "end_byte": 568
          },
          "signature": "pub trait Store {\n    type Error;\n    fn get(&self) -> Result<(), Self::Error>;\n}",
          "retained_in_mode": true
        },
        {
          "stable_key": "fixtures/schema/input.rs::trait::Store::assoc_type::Error",
          "parent_key": "fixtures/schema/input.rs::trait::Store",
          "kind": "associated_type",
          "name": "Error",
          "span": {
            "start_line": 20,
            "end_line": 20,
            "start_byte": 509,
            "end_byte": 520
          },
          "signature": "    type Error;",
          "retained_in_mode": true
        },
        {
          "stable_key": "fixtures/schema/input.rs::trait::Store::method::get",
          "parent_key": "fixtures/schema/input.rs::trait::Store",
          "kind": "method",
          "name": "get",
          "span": {
            "start_line": 21,
            "end_line": 21,
            "start_byte": 525,
            "end_byte": 566
          },
          "signature": "    fn get(&self) -> Result<(), Self::Error>;",
          "retained_in_mode": true
        },
        {
          "stable_key": "fixtures/schema/input.rs::fn::open",
          "parent_key": null,
          "kind": "function",
          "name": "open",
          "span": {
            "start_line": 24,
            "end_line": 28,
            "start_byte": 570,
            "end_byte": 651
          },
          "signature": "pub fn open() -> Session;",
          "retained_in_mode": true
        }
      ]
    }
  ]
}
