{
  "schema": "codect.show.v1",
  "input": "stdin",
  "revision": null,
  "mode": "types",
  "files": [
    {
      "path": "fixtures/schema/input.rs",
      "language": "rust",
      "projection": {
        "text": "pub struct Session {\n    token: Token,\n}\n\npub trait Store {\n    type Error;\n}\n",
        "items": [
          {
            "stable_key": "fixtures/schema/input.rs::type::Session",
            "parent_key": null,
            "kind": "type",
            "name": "Session",
            "span": {
              "start_line": 9,
              "end_line": 11,
              "start_byte": 428,
              "end_byte": 468
            },
            "canonical_text": "pub struct Session {\n    token: Token,\n}"
          },
          {
            "stable_key": "fixtures/schema/input.rs::type::Session::field::token",
            "parent_key": "fixtures/schema/input.rs::type::Session",
            "kind": "field",
            "name": "token",
            "span": {
              "start_line": 10,
              "end_line": 10,
              "start_byte": 453,
              "end_byte": 465
            },
            "canonical_text": "    token: Token,"
          },
          {
            "stable_key": "fixtures/schema/input.rs::trait::Store",
            "parent_key": null,
            "kind": "trait",
            "name": "Store",
            "span": {
              "start_line": 20,
              "end_line": 23,
              "start_byte": 604,
              "end_byte": 685
            },
            "canonical_text": "pub trait Store {\n    type Error;\n}"
          },
          {
            "stable_key": "fixtures/schema/input.rs::trait::Store::assoc_type::Error",
            "parent_key": "fixtures/schema/input.rs::trait::Store",
            "kind": "associated_type",
            "name": "Error",
            "span": {
              "start_line": 21,
              "end_line": 21,
              "start_byte": 626,
              "end_byte": 637
            },
            "canonical_text": "    type Error;"
          }
        ]
      },
      "outline": [
        {
          "stable_key": "fixtures/schema/input.rs::type::Session",
          "parent_key": null,
          "kind": "type",
          "name": "Session",
          "span": {
            "start_line": 9,
            "end_line": 11,
            "start_byte": 428,
            "end_byte": 468
          },
          "signature": "pub struct Session {\n    token: Token,\n}",
          "retained_in_mode": true
        },
        {
          "stable_key": "fixtures/schema/input.rs::type::Session::field::token",
          "parent_key": "fixtures/schema/input.rs::type::Session",
          "kind": "field",
          "name": "token",
          "span": {
            "start_line": 10,
            "end_line": 10,
            "start_byte": 453,
            "end_byte": 465
          },
          "signature": "    token: Token,",
          "retained_in_mode": true
        },
        {
          "stable_key": "impl Session",
          "parent_key": null,
          "kind": "trait_implementation",
          "name": "Session",
          "span": {
            "start_line": 13,
            "end_line": 18,
            "start_byte": 470,
            "end_byte": 602
          },
          "signature": "impl Session {\n    pub fn refresh(&mut self, token: Token) -> Result<(), Error>;\n}",
          "retained_in_mode": false
        },
        {
          "stable_key": "impl Session::method::refresh",
          "parent_key": "impl Session",
          "kind": "method",
          "name": "refresh",
          "span": {
            "start_line": 14,
            "end_line": 17,
            "start_byte": 489,
            "end_byte": 600
          },
          "signature": "    pub fn refresh(&mut self, token: Token) -> Result<(), Error>;",
          "retained_in_mode": false
        },
        {
          "stable_key": "fixtures/schema/input.rs::trait::Store",
          "parent_key": null,
          "kind": "trait",
          "name": "Store",
          "span": {
            "start_line": 20,
            "end_line": 23,
            "start_byte": 604,
            "end_byte": 685
          },
          "signature": "pub trait Store {\n    type Error;\n    fn get(&self) -> Result<(), Self::Error>;\n}",
          "retained_in_mode": true
        },
        {
          "stable_key": "fixtures/schema/input.rs::trait::Store::assoc_type::Error",
          "parent_key": "fixtures/schema/input.rs::trait::Store",
          "kind": "associated_type",
          "name": "Error",
          "span": {
            "start_line": 21,
            "end_line": 21,
            "start_byte": 626,
            "end_byte": 637
          },
          "signature": "    type Error;",
          "retained_in_mode": true
        },
        {
          "stable_key": "fixtures/schema/input.rs::trait::Store::method::get",
          "parent_key": "fixtures/schema/input.rs::trait::Store",
          "kind": "method",
          "name": "get",
          "span": {
            "start_line": 22,
            "end_line": 22,
            "start_byte": 642,
            "end_byte": 683
          },
          "signature": "    fn get(&self) -> Result<(), Self::Error>;",
          "retained_in_mode": false
        },
        {
          "stable_key": "fixtures/schema/input.rs::fn::open",
          "parent_key": null,
          "kind": "function",
          "name": "open",
          "span": {
            "start_line": 25,
            "end_line": 29,
            "start_byte": 687,
            "end_byte": 768
          },
          "signature": "pub fn open() -> Session;",
          "retained_in_mode": false
        },
        {
          "stable_key": "fixtures/schema/input.rs::mod::tests",
          "parent_key": null,
          "kind": "module",
          "name": "tests",
          "span": {
            "start_line": 32,
            "end_line": 39,
            "start_byte": 783,
            "end_byte": 909
          },
          "signature": "#[cfg(test)]\nmod tests {\n    #[test]\n    fn a_test_is_retained_in_tests_mode();\n    pub fn helper_is_not();\n}",
          "retained_in_mode": false
        },
        {
          "stable_key": "fixtures/schema/input.rs::mod::tests::fn::a_test_is_retained_in_tests_mode",
          "parent_key": "fixtures/schema/input.rs::mod::tests",
          "kind": "function",
          "name": "a_test_is_retained_in_tests_mode",
          "span": {
            "start_line": 36,
            "end_line": 36,
            "start_byte": 836,
            "end_byte": 876
          },
          "signature": "    #[test]\n    fn a_test_is_retained_in_tests_mode();",
          "retained_in_mode": false
        },
        {
          "stable_key": "fixtures/schema/input.rs::mod::tests::fn::helper_is_not",
          "parent_key": "fixtures/schema/input.rs::mod::tests",
          "kind": "function",
          "name": "helper_is_not",
          "span": {
            "start_line": 38,
            "end_line": 38,
            "start_byte": 882,
            "end_byte": 907
          },
          "signature": "    pub fn helper_is_not();",
          "retained_in_mode": false
        }
      ]
    }
  ]
}
